Date_seances,Num_page,Titre,Texte,Thème
10 janvier 2022,220.0,LIMITATION DE L’ENGRILLAGEMENT DES ESPACES NATURELS ET PROTECTION DE LA PROPRIÉTÉ PRIVÉE Adoption d’une proposition de loi  dans le texte de la commission modifié,Article 1er,PROPOSITION DE LOI VISANT À LIMITER L’ENGRILLAGEMENT DES ESPACES NATURELS ET À PROTÉGER LA PROPRIÉTÉ PRIVÉE
03 février 2022,1318.0,QUESTIONS ORALES,,
15 novembre 2022,5443.0,ÉTABLISSEMENT D’UNE PAIX DURABLE ENTRE L’ARMÉNIE ET L’AZERBAÏDJAN,,SUITE DE LA DISCUSSION ET ADOPTION D’UN PROJET DE LOI MODIFIÉ
05 décembre 2022,7890.0,LOI DE FINANCES POUR 2023,Après l’article 41 A,SUITE DE LA DISCUSSION D’UN PROJET DE LOI
05 décembre 2022,7891.0,LOI DE FINANCES POUR 2023,Après l’article 41 A,SUITE DE LA DISCUSSION D’UN PROJET DE LOI
