Date_seances,Num_page,Titre,Texte,Thème
25 janvier 2022,910.0,QUESTIONS ORALES,,
25 janvier 2022,911.0,QUESTIONS ORALES,,
27 juillet 2022,2561.0,QUESTIONS D’ACTUALITÉ  AU GOUVERNEMENT,,
27 juillet 2022,2562.0,QUESTIONS D’ACTUALITÉ  AU GOUVERNEMENT,,
04 octobre 2022,3450.0,URGENCES HOSPITALIÈRES ET SOINS NON PROGRAMMÉS Débat organisé à la demande du groupe  Les Républicains,,
18 octobre 2022,3950.0,FORMATION DES INTERNES  EN MÉDECINE GÉNÉRALE ET LUTTE  CONTRE LES DÉSERTS MÉDICAUX,Après l’article unique,PROPOSITION DE LOI VISANT À LA CONSOLIDATION ET À LA PROFESSIONNALISATION DE LA FORMATION DES INTERNES EN MÉDECINE GÉNÉRALE
29 novembre 2022,7115.0,LOI DE FINANCES POUR 2023,,SUITE DE LA DISCUSSION D’UN PROJET DE LOI
29 novembre 2022,7140.0,LOI DE FINANCES POUR 2023,,SUITE DE LA DISCUSSION D’UN PROJET DE LOI
08 novembre 2022,4982.0,FINANCEMENT DE LA SÉCURITÉ SOCIALE POUR 2023,Après l’article 8,SUITE DE LA DISCUSSION D’UN PROJET DE LOI
